{
 "$schema": "https://json-schema.org/draft/2020-12/schema",
 "$id": "model",
 "title": "model",
 "type": "object",
 "required": [
  "id",
  "type",
  "name",
  "architecture",
  "params_b",
  "status",
  "confidence",
  "updated",
  "sources"
 ],
 "properties": {
  "id": {
   "type": "string",
   "pattern": "^[a-z0-9]+(-[a-z0-9]+)*$"
  },
  "type": {
   "const": "model"
  },
  "name": {
   "type": "string"
  },
  "family": {
   "type": [
    "string",
    "null"
   ],
   "description": "release family, e.g. llama, qwen, gpt, claude, deepseek, qwen3"
  },
  "vendor": {
   "type": [
    "string",
    "null"
   ]
  },
  "release_year": {
   "type": [
    "integer",
    "null"
   ]
  },
  "architecture": {
   "enum": [
    "dense",
    "moe",
    "hybrid-mamba",
    "hybrid-attention-ssm",
    "ssm",
    "recurrent",
    "diffusion",
    "other"
   ]
  },
  "task": {
   "type": [
    "string",
    "null"
   ],
   "description": "What the model does. decision = takes a state plus a schema of typed questions and returns per-option probabilities in one forward pass (see docs/33-decision-models.md); it is excluded from the worth-running ranking because that view averages text benchmarks, which a decision model never produces.",
   "enum": [
    "text-generation",
    "embedding",
    "reranking",
    "speech-to-text",
    "text-to-speech",
    "vision-language",
    "image-generation",
    "decision",
    "other",
    null
   ]
  },
  "params_b": {
   "type": [
    "number",
    "null"
   ],
   "description": "total parameter count in billions"
  },
  "active_params_b": {
   "type": [
    "number",
    "null"
   ],
   "description": "active/activated params per token; equals params_b for dense"
  },
  "num_experts": {
   "type": [
    "integer",
    "null"
   ]
  },
  "experts_per_token": {
   "type": [
    "integer",
    "null"
   ]
  },
  "shared_expert": {
   "type": [
    "boolean",
    "null"
   ],
   "description": "always-on shared expert (DeepSeek-style) adds to per-token active params"
  },
  "hidden_size": {
   "type": [
    "integer",
    "null"
   ]
  },
  "embedding_dims": {
   "type": [
    "integer",
    "null"
   ],
   "description": "output embedding dimensionality. The decision-relevant number for an embedding or reranking model: it sets the index size (dims x 4 bytes per vector) and the per-query ANN cost, and for Matryoshka models it is truncatable at query time. Null for autoregressive LMs, which have no fixed output vector."
  },
  "embedding_pooling": {
   "type": [
    "string",
    "null"
   ],
   "enum": [
    "cls",
    "mean",
    "last",
    "max",
    "none",
    null
   ],
   "description": "pooling that produces the embedding vector. CLS for BERT-style models, mean for models trained with average pooling, last for decoder-only. Getting this wrong silently degrades retrieval quality with no error."
  },
  "num_layers": {
   "type": [
    "integer",
    "null"
   ]
  },
  "num_kv_heads": {
   "type": [
    "integer",
    "null"
   ]
  },
  "head_dim": {
   "type": [
    "integer",
    "null"
   ]
  },
  "kv_lora_rank": {
   "type": [
    "integer",
    "null"
   ],
   "description": "MLA latent KV rank: the width of the compressed KV vector actually cached, in place of num_kv_heads * head_dim. DeepSeek-V2/V3 use 512. This is why an MLA model can hold a longer context than a GQA model of similar size, and it is NOT derivable from head_dim. Null for non-MLA models."
  },
  "qk_rope_head_dim": {
   "type": [
    "integer",
    "null"
   ],
   "description": "MLA decoupled rotary sub-head width (64 in DeepSeek-V2/V3). Added to kv_lora_rank to give the per-layer per-token KV cache size: num_layers * (kv_lora_rank + qk_rope_head_dim) * bytes_per_element. Null for non-MLA models."
  },
  "qk_nope_head_dim": {
   "type": [
    "integer",
    "null"
   ],
   "description": "MLA non-positional (NoPE) QK sub-head width (128 in DeepSeek-V2/V3). Affects attention arithmetic and the projection shapes, not the cached KV size. Null for non-MLA models."
  },
  "v_head_dim": {
   "type": [
    "integer",
    "null"
   ],
   "description": "MLA value sub-head width. In DeepSeek-V2/V3 this equals qk_nope_head_dim, which is why MLA caches (kv_lora_rank + qk_rope_head_dim) and NOT (2 * v_head_dim) bytes per token. Recorded separately because the two are independent in general. Null for non-MLA models."
  },
  "kv_compression": {
   "type": [
    "string",
    "null"
   ],
   "description": "per-layer KV compression, when it is not uniform. V4-style CSA (compressed-sparse attention) gives selected layers a much lower compression ratio than the HCA baseline, so a single average ratio hides the real peak. Describe the ratio per layer group and name the groups. Null when the model has no layered compression or the compression is uniform."
  },
  "attention_layer_indices": {
   "type": "array",
   "items": {
    "type": [
     "integer",
     "null"
    ]
   },
   "description": "zero-based indices of the layers that are full attention, for hybrid architectures. Hybrid KV cost depends entirely on this split: only these layers carry a KV cache. Null for uniform architectures."
  },
  "layer_types": {
   "type": "array",
   "items": {
    "type": [
     "string",
     "null"
    ]
   },
   "description": "per-layer type in layer order, e.g. ['attention','ssm','attention',...]. Pairs with attention_layer_indices; when present its length should equal num_layers. Null when the architecture is uniform."
  },
  "gqa_ratio": {
   "type": [
    "number",
    "null"
   ],
   "description": "num_attention_heads / num_kv_heads"
  },
  "max_position_embeddings": {
   "type": [
    "integer",
    "null"
   ]
  },
  "context_scaling": {
   "type": [
    "string",
    "null"
   ],
   "description": "YaRN, NTK-aware, LongRoPE, mrope, etc; null when native"
  },
  "context_scaling_method": {
   "type": [
    "string",
    "null"
   ],
   "enum": [
    "native",
    "none-verified",
    "pi",
    "ntk-aware",
    "yarn",
    "self-extend",
    "llama3",
    "mrope",
    "linear",
    "other",
    "unknown",
    null
   ],
   "description": "queryable classification of the context-extension method. Deliberately NOT an enum on context_scaling: that field has no enum and carries free-text values in 100+ existing records ('verified native', 'mrope', 'llama3 rope scaling'), so an enum there would break all of them at once. Keep the detail in context_scaling and the class here. native = extended to the model's own trained length with no scaling; none-verified = suspected native but not confirmed; unknown = not established. `unknown` means the record's author looked and could not establish the method; null means the field was simply never filled in."
  },
  "activation": {
   "type": [
    "string",
    "null"
   ],
   "description": "silu, gelu, swiglu, geglu, etc"
  },
  "attention_variant": {
   "type": [
    "string",
    "null"
   ],
   "description": "standard, MLA (multi-head latent attention), GQA, MQA, sliding-window/hybrid, NSA, lightning attention"
  },
  "kv_cache_bytes_per_token": {
   "type": [
    "number",
    "null"
   ],
   "description": "the single most decision-relevant number for serving; derive in notes"
  },
  "flops_per_token_active": {
   "type": [
    "number",
    "null"
   ],
   "description": "approx 2 * active_params_b * 1e9; the per-token compute cost"
  },
  "open_weights": {
   "type": [
    "boolean",
    "null"
   ]
  },
  "license": {
   "type": [
    "string",
    "null"
   ]
  },
  "notes": {
   "type": "string"
  },
  "status": {
   "enum": [
    "verified",
    "draft",
    "contested",
    "deprecated"
   ]
  },
  "confidence": {
   "type": "number"
  },
  "updated": {
   "type": "string",
   "pattern": "^\\d{4}-\\d{2}-\\d{2}$"
  },
  "sources": {
   "type": "array",
   "items": {
    "type": "string"
   },
   "description": "source ids; each must exist in data/sources/"
  },
  "benchmarks": {
   "type": "array",
   "description": "Published benchmark scores used to rank capability. Each entry: {name, score, scale, higher_is_better, source, vendor_claim, config}. score/scale must be comparable across models, so scale is the maximum (100 for a percentage). vendor_claim true when the lab published the number. config states the evaluation setting the number was measured at (reasoning level, tools, scaffold) whenever the source documents one, because a ceiling-effort number is not comparable to a default-effort one.",
   "items": {
    "type": "object",
    "required": [
     "name",
     "score",
     "scale",
     "source"
    ],
    "properties": {
     "name": {
      "type": "string"
     },
     "score": {
      "type": "number"
     },
     "scale": {
      "type": "number"
     },
     "higher_is_better": {
      "type": "boolean"
     },
     "source": {
      "type": "string"
     },
     "vendor_claim": {
      "type": "boolean"
     },
     "config": {
      "type": "string",
      "description": "Evaluation configuration the score was measured at, e.g. \"reasoning=medium (chat template default), no tools\". Record the model's DEFAULT serving configuration where the source documents one; if only a ceiling is published, say so here so the reader knows it assumes a large test-time compute budget."
     }
    }
   }
  },
  "base_model": {
   "type": [
    "string",
    "null"
   ],
   "description": "HF repo id of the model this record was post-trained or merged from, e.g. Qwen/Qwen3.6-35B-A3B. Set on fine-tunes, merges and abliterations so the derivative is a first-class record while its provenance stays machine-readable. Quants and format ports are NOT records; they belong in data/derivatives.jsonl."
  },
  "derivative_kind": {
   "type": [
    "string",
    "null"
   ],
   "enum": [
    "finetune",
    "merge",
    "abliteration",
    "distillation",
    "rl",
    "other",
    null
   ]
  }
 },
 "additionalProperties": false
}
