{
  "id": "olmo-3-1-32b-instruct",
  "type": "model",
  "name": "allenai/Olmo-3.1-32B-Instruct",
  "status": "draft",
  "confidence": 0.6,
  "updated": "2026-10-19",
  "sources": [
    "hf-crawl-olmo-3-1-32b-instruct"
  ],
  "family": "olmo",
  "vendor": "allenai",
  "release_year": 2026,
  "architecture": "dense",
  "params_b": 32.23,
  "active_params_b": 32.23,
  "open_weights": true,
  "license": "apache-2.0",
  "task": "text-generation",
  "benchmarks": [
    {
      "name": "MATH",
      "score": 93.4,
      "scale": 100,
      "higher_is_better": true,
      "source": "hf-crawl-olmo-3-1-32b-instruct",
      "vendor_claim": true,
      "config": "vendor-published row as printed on the card; eval harness not restated"
    },
    {
      "name": "AIME 2024",
      "score": 67.8,
      "scale": 100,
      "higher_is_better": true,
      "source": "hf-crawl-olmo-3-1-32b-instruct",
      "vendor_claim": true,
      "config": "vendor-published row as printed on the card; eval harness not restated"
    },
    {
      "name": "AIME 2025",
      "score": 57.9,
      "scale": 100,
      "higher_is_better": true,
      "source": "hf-crawl-olmo-3-1-32b-instruct",
      "vendor_claim": true,
      "config": "vendor-published row as printed on the card; eval harness not restated"
    },
    {
      "name": "OMEGA",
      "score": 42.2,
      "scale": 100,
      "higher_is_better": true,
      "source": "hf-crawl-olmo-3-1-32b-instruct",
      "vendor_claim": true,
      "config": "vendor-published row as printed on the card; eval harness not restated"
    },
    {
      "name": "BigBenchHard",
      "score": 84.0,
      "scale": 100,
      "higher_is_better": true,
      "source": "hf-crawl-olmo-3-1-32b-instruct",
      "vendor_claim": true,
      "config": "vendor-published row as printed on the card; eval harness not restated"
    },
    {
      "name": "ZebraLogic",
      "score": 61.7,
      "scale": 100,
      "higher_is_better": true,
      "source": "hf-crawl-olmo-3-1-32b-instruct",
      "vendor_claim": true,
      "config": "vendor-published row as printed on the card; eval harness not restated"
    },
    {
      "name": "HumanEvalPlus",
      "score": 86.7,
      "scale": 100,
      "higher_is_better": true,
      "source": "hf-crawl-olmo-3-1-32b-instruct",
      "vendor_claim": true,
      "config": "vendor-published row as printed on the card; eval harness not restated"
    },
    {
      "name": "MBPP+",
      "score": 65.1,
      "scale": 100,
      "higher_is_better": true,
      "source": "hf-crawl-olmo-3-1-32b-instruct",
      "vendor_claim": true,
      "config": "vendor-published row as printed on the card; eval harness not restated"
    },
    {
      "name": "LiveCodeBench v3",
      "score": 54.7,
      "scale": 100,
      "higher_is_better": true,
      "source": "hf-crawl-olmo-3-1-32b-instruct",
      "vendor_claim": true,
      "config": "vendor-published row as printed on the card; eval harness not restated"
    },
    {
      "name": "IFBench",
      "score": 39.7,
      "scale": 100,
      "higher_is_better": true,
      "source": "hf-crawl-olmo-3-1-32b-instruct",
      "vendor_claim": true,
      "config": "vendor-published row as printed on the card; eval harness not restated"
    },
    {
      "name": "GPQA",
      "score": 48.6,
      "scale": 100,
      "higher_is_better": true,
      "source": "hf-crawl-olmo-3-1-32b-instruct",
      "vendor_claim": true,
      "config": "vendor-published row as printed on the card; eval harness not restated"
    }
  ],
  "notes": "Created from the 2026-10-19 HuggingFace discovery crawl. Benchmarks are the card's own published rows (vendor claims). architecture and task are inferred from the slug and param ratio; KV geometry, context length and quant sizes are not yet filled, hence status draft."
}
