{
  "id": "code-switched-egyptian-arabic-whisper-small",
  "type": "model",
  "name": "code-switched-egyptian-arabic-whisper-small",
  "family": "whisper",
  "vendor": "IbrahimAmin",
  "release_year": 2025,
  "architecture": "dense",
  "task": "speech-to-text",
  "params_b": 0.242,
  "active_params_b": 0.244,
  "num_experts": null,
  "experts_per_token": null,
  "shared_expert": null,
  "hidden_size": 768,
  "num_layers": 12,
  "num_kv_heads": 12,
  "head_dim": 64,
  "gqa_ratio": 1.0,
  "max_position_embeddings": 1500,
  "context_scaling": "Inherited unchanged from openai/whisper-small (config.json max_position_embeddings 1500). This derivative does not publish a context-extension recipe of its own.",
  "context_scaling_method": "native",
  "activation": "gelu",
  "attention_variant": "MHA, encoder-decoder (cross-attention)",
  "layer_types": [],
  "attention_layer_indices": [],
  "kv_cache_bytes_per_token": 36864,
  "flops_per_token_active": 1464000000.0,
  "open_weights": true,
  "license": "apache-2.0",
  "base_model": "openai/whisper-small",
  "derivative_kind": "finetune",
  "notes": "ADDED 2026-10-27. A finetune of openai/whisper-small, not a new base model: same config.json, same 0.242 parameters . Recorded as a contender because it publishes benchmark evidence against its own base; the evidence rows below are card-sourced and marked vendor_claim. Licence apache-2.0, repo created 2025-05-07.",
  "status": "verified",
  "confidence": 0.5,
  "updated": "2026-10-27",
  "sources": [
    "hf-ibrahimamin-code-switched-egyptian-arabic-whisper-small"
  ],
  "benchmarks": [
    {
      "name": "FLEURS ar_eg WER",
      "score": 24.36,
      "scale": 100,
      "higher_is_better": false,
      "source": "hf-ibrahimamin-code-switched-egyptian-arabic-whisper-small",
      "vendor_claim": true,
      "config": "Card table 'Baseline Whisper Small WER (%) | Fine-Tuned Model WER (%)': 30.29 -> 24.36. fleurs ar_eg train subset was used in training, so in-domain. beam_size=5, BasicTextNormalizer."
    },
    {
      "name": "ESCWA WER",
      "score": 45.12,
      "scale": 100,
      "higher_is_better": false,
      "source": "hf-ibrahimamin-code-switched-egyptian-arabic-whisper-small",
      "vendor_claim": true,
      "config": "Same table, base 98.15."
    },
    {
      "name": "Common Voice 17 ar test WER",
      "score": 69.14,
      "scale": 100,
      "higher_is_better": false,
      "source": "hf-ibrahimamin-code-switched-egyptian-arabic-whisper-small",
      "vendor_claim": true,
      "config": "Same table, base 74.16."
    }
  ]
}
