{
  "id": "tanpo-product",
  "type": "model",
  "name": "tanpo-product",
  "family": "lfm2",
  "vendor": "d4rkninja",
  "release_year": 2026,
  "architecture": "hybrid-attention-ssm",
  "task": "text-generation",
  "params_b": 1.17,
  "active_params_b": 1.17,
  "num_experts": null,
  "experts_per_token": null,
  "shared_expert": null,
  "hidden_size": 2048,
  "num_layers": 16,
  "num_kv_heads": 8,
  "head_dim": 64,
  "gqa_ratio": 4.0,
  "max_position_embeddings": 128000,
  "context_scaling": "Inherited unchanged from LiquidAI/LFM2.5-1.2B-Instruct (config.json max_position_embeddings 128000). This derivative does not publish a context-extension recipe of its own.",
  "context_scaling_method": "native",
  "activation": "swiglu",
  "attention_variant": "hybrid: layer_types = 10x conv + 6x full_attention of 16",
  "layer_types": [
    "conv",
    "conv",
    "full_attention",
    "conv",
    "conv",
    "full_attention",
    "conv",
    "conv",
    "full_attention",
    "conv",
    "full_attention",
    "conv",
    "full_attention",
    "conv",
    "full_attention",
    "conv"
  ],
  "attention_layer_indices": [
    2,
    5,
    8,
    10,
    12,
    14
  ],
  "kv_cache_bytes_per_token": 0.0,
  "flops_per_token_active": 7020000000.0,
  "open_weights": true,
  "license": "other",
  "base_model": "LiquidAI/LFM2.5-1.2B-Instruct",
  "derivative_kind": "finetune",
  "notes": "ADDED 2026-10-29. A finetune of LiquidAI/LFM2.5-1.2B-Instruct, not a new base model: same config.json, same 1.17 parameters (identical tensor set). Recorded as a contender because it publishes benchmark evidence against its own base; the evidence rows below are card-sourced and marked vendor_claim. Licence other, repo created 2026-09-17.",
  "status": "verified",
  "confidence": 0.5,
  "updated": "2026-10-29",
  "sources": [
    "hf-d4rkninja-tanpo-product"
  ],
  "benchmarks": [
    {
      "name": "DarkLab 20-task product rubric, overall %",
      "score": 99.4,
      "scale": 100,
      "higher_is_better": true,
      "source": "hf-d4rkninja-tanpo-product",
      "vendor_claim": true,
      "config": "Card table 'Internal automated domain evaluation (DarkLab harness)' | Model | Rubric overall |: Base LFM2.5-1.2B-Instruct 92.6% vs tanpo-product 99.4%. Same prompts and generation config for both. Card prints 'Treat as directional, not an industry benchmark' and ~20 held-out product-format tasks scored by the author's own rubric."
    }
  ]
}
