{
  "id": "bge-m3-bangla",
  "type": "model",
  "name": "bge-m3-bangla",
  "family": "bge",
  "vendor": "nahidstaq",
  "release_year": 2026,
  "architecture": "dense",
  "task": "embedding",
  "params_b": 0.568,
  "active_params_b": 0.568,
  "num_experts": null,
  "experts_per_token": null,
  "shared_expert": null,
  "hidden_size": 1024,
  "num_layers": 24,
  "num_kv_heads": 16,
  "head_dim": 64,
  "gqa_ratio": 1,
  "max_position_embeddings": 8194,
  "context_scaling": "Inherited unchanged from BAAI/bge-m3 (config.json max_position_embeddings 8194). This derivative does not publish a context-extension recipe of its own.",
  "context_scaling_method": "native",
  "activation": "gelu",
  "attention_variant": "bidirectional encoder (XLM-RoBERTa), full attention, no causal mask",
  "layer_types": [],
  "attention_layer_indices": [],
  "kv_cache_bytes_per_token": 0.0,
  "flops_per_token_active": 3407999999.9999995,
  "open_weights": true,
  "license": "mit",
  "base_model": "BAAI/bge-m3",
  "derivative_kind": "finetune",
  "notes": "ADDED 2026-10-30. A finetune of BAAI/bge-m3, not a new base model: same config.json, same 0.568B parameters (identical tensor set). Recorded as a contender because it publishes benchmark evidence against its own base; the evidence rows below are card-sourced and marked vendor_claim. Licence mit, repo created 2026-03-15. LoRA rank 32 / alpha 64 on 39,082 cross-script pairs. The base record's MIRACL/MTEB rows are a different instrument and are not comparable to these.",
  "status": "verified",
  "confidence": 0.5,
  "updated": "2026-10-30",
  "sources": [
    "hf-nahidstaq-bge-m3-bangla"
  ],
  "benchmarks": [
    {
      "name": "Average cross-script cosine similarity",
      "score": 78.8,
      "scale": 100,
      "higher_is_better": true,
      "source": "hf-nahidstaq-bge-m3-bangla",
      "vendor_claim": true,
      "config": "Card 'Key Results' table, column Fine-tuned 0.788 vs column Base BGE-M3 0.689, on the author's Bangla/Banglish/mixed-script pair set (39,082 training examples)."
    },
    {
      "name": "Bangla <-> Banglish similarity",
      "score": 86.1,
      "scale": 100,
      "higher_is_better": true,
      "source": "hf-nahidstaq-bge-m3-bangla",
      "vendor_claim": true,
      "config": "Same table: 0.861 vs base 0.652."
    },
    {
      "name": "Banglish <-> English similarity",
      "score": 91.9,
      "scale": 100,
      "higher_is_better": true,
      "source": "hf-nahidstaq-bge-m3-bangla",
      "vendor_claim": true,
      "config": "Same table: 0.919 vs base 0.680."
    },
    {
      "name": "Dev triplet accuracy %",
      "score": 98.74,
      "scale": 100,
      "higher_is_better": true,
      "source": "hf-nahidstaq-bge-m3-bangla",
      "vendor_claim": true,
      "config": "Same table: 98.74% vs base 95.30%, dev split. Card also reports Retrieval Hit@1 1.000 vs 1.000 (tie, not recorded as a win) and admits pure-Bangla informal similarity fell 0.12."
    }
  ]
}
