{
  "id": "resume-jd-matcher-mpnet",
  "type": "model",
  "name": "resume-jd-matcher-mpnet",
  "family": "sentence-transformers",
  "vendor": "dlepighe1",
  "release_year": 2026,
  "architecture": "dense",
  "task": "embedding",
  "params_b": 0.109,
  "active_params_b": 0.109,
  "num_experts": null,
  "experts_per_token": null,
  "shared_expert": null,
  "hidden_size": 768,
  "num_layers": 12,
  "num_kv_heads": 12,
  "head_dim": 64,
  "gqa_ratio": 1,
  "max_position_embeddings": 514,
  "context_scaling": "Inherited unchanged from sentence-transformers/all-mpnet-base-v2 (config.json max_position_embeddings 514). This derivative does not publish a context-extension recipe of its own.",
  "context_scaling_method": "native",
  "activation": "gelu",
  "attention_variant": "bidirectional encoder (MPNet), full attention, no causal mask, relative position bias",
  "layer_types": [],
  "attention_layer_indices": [],
  "kv_cache_bytes_per_token": 0.0,
  "flops_per_token_active": 654000000.0,
  "open_weights": true,
  "license": "apache-2.0",
  "base_model": "sentence-transformers/all-mpnet-base-v2",
  "derivative_kind": "finetune",
  "notes": "ADDED 2026-10-29. A finetune of sentence-transformers/all-mpnet-base-v2, not a new base model: same config.json, same 0.109 parameters (identical tensor set). Recorded as a contender because it publishes benchmark evidence against its own base; the evidence rows below are card-sourced and marked vendor_claim. Licence apache-2.0, repo created 2026-07-27.",
  "status": "verified",
  "confidence": 0.5,
  "updated": "2026-10-29",
  "sources": [
    "hf-dlepighe1-resume-jd-matcher-mpnet"
  ],
  "benchmarks": [
    {
      "name": "Spearman, held-out 106 resume/JD pairs",
      "score": 0.8163,
      "scale": 1,
      "higher_is_better": true,
      "source": "hf-dlepighe1-resume-jd-matcher-mpnet",
      "vendor_claim": true,
      "config": "Card 'Evaluation' table: 'Spearman (production seed 43)' 0.8163 [0.7396, 0.8638] vs row 'Base model before fine-tuning' 0.6246 / 0.2138. The base row packs Spearman/MAE in one cell; ordering taken from the table's own column order. 106 pairs from 53 postings with zero training overlap; labels are synthetic rubric matches."
    },
    {
      "name": "MAE, held-out 106 resume/JD pairs",
      "score": 0.127,
      "scale": 1,
      "higher_is_better": false,
      "source": "hf-dlepighe1-resume-jd-matcher-mpnet",
      "vendor_claim": true,
      "config": "Same table: MAE 0.1270 [0.108, 0.1462] vs base 0.2138. Lower is better. n=106, so the card's own CIs are wide."
    }
  ]
}
