{
  "id": "otel-embedding-22m",
  "type": "model",
  "name": "OTel-Embedding-22M",
  "family": "sentence-transformers",
  "vendor": "farbodtavakkoli",
  "release_year": 2026,
  "architecture": "dense",
  "task": "embedding",
  "params_b": 0.023,
  "active_params_b": 0.0227,
  "num_experts": null,
  "experts_per_token": null,
  "shared_expert": null,
  "hidden_size": 384,
  "num_layers": 6,
  "num_kv_heads": 12,
  "head_dim": 32,
  "gqa_ratio": 1,
  "max_position_embeddings": 512,
  "context_scaling": "Inherited unchanged from sentence-transformers/all-MiniLM-L6-v2 (config.json max_position_embeddings 512). This derivative does not publish a context-extension recipe of its own.",
  "context_scaling_method": "native",
  "activation": "gelu",
  "attention_variant": "bidirectional encoder (BERT), full attention, no causal mask",
  "layer_types": [],
  "attention_layer_indices": [],
  "kv_cache_bytes_per_token": 0.0,
  "flops_per_token_active": 136200000.0,
  "open_weights": true,
  "license": "apache-2.0",
  "base_model": "sentence-transformers/all-MiniLM-L6-v2",
  "derivative_kind": "finetune",
  "notes": "ADDED 2026-10-26. A finetune of sentence-transformers/all-MiniLM-L6-v2, not a new base model: same config.json, same 0.023 parameters . Recorded as a contender because it publishes benchmark evidence against its own base; the evidence rows below are card-sourced and marked vendor_claim. Licence apache-2.0, repo created 2026-02-02. CAVEATS: Single row: NDCG@10 on a held-out 10% partition of the authors' own OTel-Embedding telecom dataset. The card states the aggregate does not guarantee subdomain performance and that this is not an external benchmark. 22M params, all-MiniLM-L6-v2 base. Delta +59.7pp is large because the base has no telecom training at all.",
  "status": "verified",
  "confidence": 0.5,
  "updated": "2026-10-26",
  "sources": [
    "hf-farbodtavakkoli-otel-embedding-22m"
  ],
  "benchmarks": [
    {
      "name": "OTel telecom retrieval NDCG@10",
      "score": 83.8,
      "scale": 100,
      "higher_is_better": true,
      "source": "hf-farbodtavakkoli-otel-embedding-22m",
      "vendor_claim": true,
      "config": "Card table 'OTel vs. Base Model': base model 24.1% vs OTel fine-tuned 83.8% +/- 0.8, delta +59.7 pp, OTel-Embedding held-out 10% split, bootstrap n=1000. Held-out OTel partition only, not an external benchmark."
    }
  ]
}
