{
  "id": "sky-t1-32b-flash",
  "type": "model",
  "name": "Sky-T1-32B-Flash",
  "family": "sky",
  "vendor": "NovaSky-AI",
  "release_year": 2025,
  "architecture": "dense",
  "task": "text-generation",
  "params_b": 32.764,
  "active_params_b": 32.76,
  "num_experts": null,
  "experts_per_token": null,
  "shared_expert": null,
  "hidden_size": 5120,
  "num_layers": 64,
  "num_kv_heads": 8,
  "head_dim": 128,
  "gqa_ratio": 5,
  "max_position_embeddings": 32768,
  "context_scaling": "Inherited unchanged from NovaSky-AI/Sky-T1-32B-Preview (config.json max_position_embeddings 32768). This derivative does not publish a context-extension recipe of its own.",
  "context_scaling_method": "native",
  "activation": "silu",
  "attention_variant": "Inherited unchanged from NovaSky-AI/Sky-T1-32B-Preview: 64 full GQA layers (kv heads 8, head_dim 128) and 0 other layers, per the base config.json.",
  "layer_types": [],
  "attention_layer_indices": [],
  "kv_cache_bytes_per_token": 262144,
  "flops_per_token_active": 196560000000.0,
  "open_weights": true,
  "license": "apache-2.0",
  "base_model": "NovaSky-AI/Sky-T1-32B-Preview",
  "derivative_kind": "rl",
  "notes": "ADDED 2026-10-31. SimPO (10K preference pairs, lr 5e-7, beta 2.0) on top of NovaSky-AI/Sky-T1-32B-Preview, same 32.76B Qwen2.5-32B config. Recorded for one strict accuracy win, LCB Easy 89.0 vs 87.4, and a tie at Math500 88.6 and AIME24 43.3 - while LCB Medium slips 56.3 vs 56.8. Its actual claim is efficiency: -33% to -57% average generation length at equal accuracy. Note the card ALSO lists Qwen/Qwen2.5-32B-Instruct as a base_model tag; the comparison table's predecessor column is Sky-T1-32B-Preview, which is what this record is based on. Licence Apache-2.0, repo created 2025-01-23.",
  "status": "verified",
  "confidence": 0.5,
  "updated": "2026-10-31",
  "sources": [
    "hf-novasky-ai-sky-t1-32b-flash"
  ],
  "benchmarks": [
    {
      "name": "LiveCodeBench Easy accuracy",
      "score": 89.0,
      "scale": 100,
      "higher_is_better": true,
      "source": "hf-novasky-ai-sky-t1-32b-flash",
      "vendor_claim": true,
      "config": "Card table '|  |  | Sky-T1-32B-Preview | Sky-T1-32B-Flash |': LCB Easy Acc 87.4 vs 89.0 - the only strict accuracy win. Base is NovaSky-AI/Sky-T1-32B-Preview, same table."
    },
    {
      "name": "Math500 accuracy",
      "score": 88.6,
      "scale": 100,
      "higher_is_better": true,
      "source": "hf-novasky-ai-sky-t1-32b-flash",
      "vendor_claim": true,
      "config": "Same table, Math500 Acc 88.6 vs 88.6 - a tie, recorded as parity. Card's actual claim is -33% avg generation length (2124 -> 1417 tokens) at equal accuracy."
    },
    {
      "name": "AIME24 accuracy",
      "score": 43.3,
      "scale": 100,
      "higher_is_better": true,
      "source": "hf-novasky-ai-sky-t1-32b-flash",
      "vendor_claim": true,
      "config": "Same table, AIME24 Acc 43.3 vs 43.3 - a tie. Avg length 6881 -> 4365 (-37%)."
    },
    {
      "name": "LiveCodeBench Medium accuracy",
      "score": 56.3,
      "scale": 100,
      "higher_is_better": true,
      "source": "hf-novasky-ai-sky-t1-32b-flash",
      "vendor_claim": true,
      "config": "Same table, LCB Medium Acc 56.8 base vs 56.3 - a LOSS recorded for honesty (-47% length)."
    }
  ]
}
