{
 "id": "magicgui-rft",
 "type": "model",
 "name": "MagicGUI_RFT",
 "family": "qwen2-vl",
 "vendor": "GUIAgent",
 "release_year": 2025,
 "architecture": "dense",
 "task": "vision-language",
 "params_b": 8.291,
 "active_params_b": 8.291,
 "num_experts": null,
 "experts_per_token": null,
 "shared_expert": null,
 "hidden_size": 3584,
 "num_layers": 28,
 "num_kv_heads": 4,
 "head_dim": 128,
 "gqa_ratio": 7.0,
 "max_position_embeddings": 32768,
 "context_scaling": "Inherited unchanged from Qwen/Qwen2-VL-7B-Instruct (config.json max_position_embeddings 32768). This derivative does not publish a context-extension recipe of its own.",
 "context_scaling_method": "native",
 "activation": "silu",
 "attention_variant": "GQA + mrope",
 "layer_types": [],
 "attention_layer_indices": [],
 "kv_cache_bytes_per_token": 57344,
 "flops_per_token_active": 49746000000.0,
 "open_weights": true,
 "license": "apache-2.0",
 "base_model": "Qwen/Qwen2-VL-7B-Instruct",
 "derivative_kind": "finetune",
 "notes": "ADDED 2026-10-31. MagicGUI-RFT is Honor's Qwen2-VL-7B GUI agent after the second of its two training stages: continued pre-training (which is the separately-catalogued magicgui-cpt) followed by reinforcement fine-tuning, aimed at on-device mobile GUI operation in Chinese and English. Same 8.29B parameters and identical tensor set as the base; the gain is behavioural, not architectural. The card prints Qwen2-VL-7B as a ROW (not a column) in the same HTML tables, so every row below is a same-table comparison. Wins are enormous and consistent - Routine SR 28.1 -> 97.5 - which is what you expect when the base has never seen the authors' action space. Read the source: Magic-RICH is the authors' own in-domain benchmark (Honor, technical report arXiv 2508.03700), so the Magic-RICH rows measure fit to their task formulation; the Referring/AndroidControl/GUI-Odyssey tables are the generalisation evidence. Note the platform drift - Qwen2.5-VL-7B outscores Qwen2-VL-7B on Magic-RICH Routine (76.3 vs 28.1) but MagicGUI's 97.5 still clears it, which is the more honest comparator than the declared base. Apache-2.0, repo created 2025-07-20. Confidence 0.5.",
 "status": "verified",
 "confidence": 0.5,
 "updated": "2026-10-31",
 "sources": [
  "hf-guiagent-magicgui-rft"
 ],
 "benchmarks": [
  {
   "name": "Magic-RICH Routine SR",
   "score": 97.5,
   "scale": 100,
   "higher_is_better": true,
   "source": "hf-guiagent-magicgui-rft",
   "vendor_claim": true,
   "config": "Card HTML table 'Performance comparison on the Magic-RICH dataset', Routine triple (Type, Grd, SR): row Qwen2-VL-7B 71.7/41.0/28.1, row MagicGUI-RFT 99.7/97.5/97.5. Base printed as a ROW, not a column, in the same table. Magic-RICH is the authors' own benchmark (arXiv 2508.03700)."
  },
  {
   "name": "Magic-RICH Instruction SR",
   "score": 94.0,
   "scale": 100,
   "higher_is_better": true,
   "source": "hf-guiagent-magicgui-rft",
   "vendor_claim": true,
   "config": "Same table, Instruction triple: Qwen2-VL-7B 73.6/43.9/41.5 vs MagicGUI-RFT 97.2/95.6/94.0. Same authors' in-domain benchmark."
  },
  {
   "name": "Magic-RICH Complex SR",
   "score": 74.1,
   "scale": 100,
   "higher_is_better": true,
   "source": "hf-guiagent-magicgui-rft",
   "vendor_claim": true,
   "config": "Same table, Complex triple: Qwen2-VL-7B 65.6/28.7/21.2 vs MagicGUI-RFT 92.1/80.4/74.1. Same authors' in-domain benchmark."
  },
  {
   "name": "Magic-RICH Handing-Exception",
   "score": 92.1,
   "scale": 100,
   "higher_is_better": true,
   "source": "hf-guiagent-magicgui-rft",
   "vendor_claim": true,
   "config": "Same table, last column (single number): Qwen2-VL-7B 68.3 vs MagicGUI-RFT 92.1. Column is spelled 'Handing Exception' on the card; kept as printed."
  }
 ]
}
