{
  "id": "kb-whisper-small",
  "type": "model",
  "name": "kb-whisper-small",
  "family": "whisper",
  "vendor": "KBLab",
  "release_year": 2025,
  "architecture": "dense",
  "task": "speech-to-text",
  "params_b": 0.282,
  "active_params_b": 0.244,
  "num_experts": null,
  "experts_per_token": null,
  "shared_expert": null,
  "hidden_size": 768,
  "num_layers": 12,
  "num_kv_heads": 12,
  "head_dim": 64,
  "gqa_ratio": 1.0,
  "max_position_embeddings": 1500,
  "context_scaling": "Inherited unchanged from openai/whisper-small (config.json max_position_embeddings 1500). This derivative does not publish a context-extension recipe of its own.",
  "context_scaling_method": "native",
  "activation": "gelu",
  "attention_variant": "MHA, encoder-decoder (cross-attention)",
  "layer_types": [],
  "attention_layer_indices": [],
  "kv_cache_bytes_per_token": 36864,
  "flops_per_token_active": 1464000000.0,
  "open_weights": true,
  "license": "apache-2.0",
  "base_model": "openai/whisper-small",
  "derivative_kind": "finetune",
  "notes": "ADDED 2026-10-25. A finetune of openai/whisper-small, not a new base model: same config.json, same 0.282 parameters . Recorded as a contender because it publishes benchmark evidence against its own base; the evidence rows below are card-sourced and marked vendor_claim. Licence apache-2.0, repo created 2025-02-14. Caveats: WER table is shared across the whole kb-whisper family, so the \"OpenAI\" row is the same-size whisper-small baseline, in the same table, per size block - that is a genuine base comparison. Swedish only; card also tags ctranslate2 conversions that live in sibling repos.",
  "status": "verified",
  "confidence": 0.5,
  "updated": "2026-10-25",
  "sources": [
    "hf-kblab-kb-whisper-small"
  ],
  "benchmarks": [
    {
      "name": "FLEURS sv (WER %)",
      "score": 7.3,
      "scale": 100,
      "higher_is_better": false,
      "source": "hf-kblab-kb-whisper-small",
      "vendor_claim": true,
      "config": "Card WER table: KBLab small 7.3 vs OpenAI whisper-small 20.6, same table/row. Lower is better."
    },
    {
      "name": "CommonVoice sv (WER %)",
      "score": 6.4,
      "scale": 100,
      "higher_is_better": false,
      "source": "hf-kblab-kb-whisper-small",
      "vendor_claim": true,
      "config": "Same table: KBLab 6.4 vs OpenAI 26.4. Lower is better."
    },
    {
      "name": "NST sv (WER %)",
      "score": 6.6,
      "scale": 100,
      "higher_is_better": false,
      "source": "hf-kblab-kb-whisper-small",
      "vendor_claim": true,
      "config": "Same table: KBLab 6.6 vs OpenAI 26.4. Lower is better."
    }
  ]
}
