{
  "id": "timelens-7b",
  "type": "model",
  "name": "TimeLens-7B",
  "family": "qwen2.5-vl",
  "vendor": "TencentARC",
  "release_year": 2025,
  "architecture": "dense",
  "task": "vision-language",
  "params_b": 8.292,
  "active_params_b": 8.292,
  "num_experts": null,
  "experts_per_token": null,
  "shared_expert": null,
  "hidden_size": 3584,
  "num_layers": 28,
  "num_kv_heads": 4,
  "head_dim": 128,
  "gqa_ratio": 7.0,
  "max_position_embeddings": 128000,
  "context_scaling": "Inherited unchanged from Qwen/Qwen2.5-VL-7B-Instruct (config.json max_position_embeddings 128000). This derivative does not publish a context-extension recipe of its own.",
  "context_scaling_method": "native",
  "activation": "silu",
  "attention_variant": "GQA + mrope + windowed ViT",
  "layer_types": [],
  "attention_layer_indices": [],
  "kv_cache_bytes_per_token": 57344,
  "flops_per_token_active": 49752000000.0,
  "open_weights": true,
  "license": "other",
  "base_model": "Qwen/Qwen2.5-VL-7B-Instruct",
  "derivative_kind": "finetune",
  "notes": "ADDED 2026-10-26. A finetune of Qwen/Qwen2.5-VL-7B-Instruct, not a new base model: same config.json, same 8.292 parameters (identical tensor set). Recorded as a contender because it publishes benchmark evidence against its own base; the evidence rows below are card-sourced and marked vendor_claim. Licence other, repo created 2025-12-16. CAVEATS: scored on Charades-TimeLens / ActivityNet-TimeLens / QVHighlights-TimeLens - the authors' own re-annotations of those benchmarks - so these are not standard Charades-STA or ActivityNet Grounding numbers and must not be compared with them. All 12 cells beat the Qwen2.5-VL-7B base; the paper link in the card is literally 'TODO'. Sibling TimeLens-8B is stronger on every cell.",
  "status": "verified",
  "confidence": 0.5,
  "updated": "2026-10-26",
  "sources": [
    "hf-tencentarc-timelens-7b"
  ],
  "benchmarks": [
    {
      "name": "Charades-TimeLens R1@0.3",
      "score": 70.5,
      "scale": 100,
      "higher_is_better": true,
      "source": "hf-tencentarc-timelens-7b",
      "vendor_claim": true,
      "config": "Card HTML table, TimeLens-7B row 70.5 vs Qwen2.5-VL-7B-Instruct row 59.7; all 12 cells higher."
    },
    {
      "name": "Charades-TimeLens R1@0.5",
      "score": 55.6,
      "scale": 100,
      "higher_is_better": true,
      "source": "hf-tencentarc-timelens-7b",
      "vendor_claim": true,
      "config": "Same table: 55.6 vs base 37.8."
    },
    {
      "name": "Charades-TimeLens R1@0.7",
      "score": 28.4,
      "scale": 100,
      "higher_is_better": true,
      "source": "hf-tencentarc-timelens-7b",
      "vendor_claim": true,
      "config": "Same table: 28.4 vs base 16.6."
    },
    {
      "name": "Charades-TimeLens mIoU",
      "score": 48.8,
      "scale": 100,
      "higher_is_better": true,
      "source": "hf-tencentarc-timelens-7b",
      "vendor_claim": true,
      "config": "Same table: 48.8 vs base 39.3."
    },
    {
      "name": "ActivityNet-TimeLens R1@0.3",
      "score": 62.8,
      "scale": 100,
      "higher_is_better": true,
      "source": "hf-tencentarc-timelens-7b",
      "vendor_claim": true,
      "config": "Same table: 62.8 vs base 44.1."
    },
    {
      "name": "ActivityNet-TimeLens R1@0.5",
      "score": 51.0,
      "scale": 100,
      "higher_is_better": true,
      "source": "hf-tencentarc-timelens-7b",
      "vendor_claim": true,
      "config": "Same table: 51.0 vs base 31.0."
    },
    {
      "name": "ActivityNet-TimeLens R1@0.7",
      "score": 32.6,
      "scale": 100,
      "higher_is_better": true,
      "source": "hf-tencentarc-timelens-7b",
      "vendor_claim": true,
      "config": "Same table: 32.6 vs base 16.1."
    },
    {
      "name": "ActivityNet-TimeLens mIoU",
      "score": 46.2,
      "scale": 100,
      "higher_is_better": true,
      "source": "hf-tencentarc-timelens-7b",
      "vendor_claim": true,
      "config": "Same table: 46.2 vs base 31.4."
    },
    {
      "name": "QVHighlights-TimeLens R1@0.3",
      "score": 74.1,
      "scale": 100,
      "higher_is_better": true,
      "source": "hf-tencentarc-timelens-7b",
      "vendor_claim": true,
      "config": "Same table: 74.1 vs base 41.5."
    },
    {
      "name": "QVHighlights-TimeLens mIoU",
      "score": 56.0,
      "scale": 100,
      "higher_is_better": true,
      "source": "hf-tencentarc-timelens-7b",
      "vendor_claim": true,
      "config": "Same table: 56.0 vs base 31.6."
    }
  ]
}
