{
 "id": "text2sql-schema-retriever-minilm",
 "type": "model",
 "name": "text2sql-schema-retriever-minilm",
 "family": "sentence-transformers",
 "vendor": "hari-krishna-ai",
 "release_year": 2026,
 "architecture": "dense",
 "task": "embedding",
 "params_b": 0.0227,
 "active_params_b": 0.0227,
 "num_experts": null,
 "experts_per_token": null,
 "shared_expert": null,
 "hidden_size": 384,
 "num_layers": 6,
 "num_kv_heads": 12,
 "head_dim": 32,
 "gqa_ratio": 1,
 "max_position_embeddings": 512,
 "context_scaling": "Inherited unchanged from sentence-transformers/all-MiniLM-L6-v2 (config.json max_position_embeddings 512). This derivative does not publish a context-extension recipe of its own.",
 "context_scaling_method": "native",
 "activation": "gelu",
 "attention_variant": "bidirectional encoder (BERT), full attention, no causal mask",
 "layer_types": [],
 "attention_layer_indices": [],
 "kv_cache_bytes_per_token": 0.0,
 "flops_per_token_active": 136200000.0,
 "open_weights": true,
 "license": "apache-2.0",
 "base_model": "sentence-transformers/all-MiniLM-L6-v2",
 "derivative_kind": "finetune",
 "notes": "ADDED 2026-10-30. A finetune of sentence-transformers/all-MiniLM-L6-v2 (labelled contrastive, question/table pairs from the train split), same 22,713,216-byte safetensors and identical tensor set as the base. Recorded because the card prints a base row in the same retriever table, on 453 held-out test questions whose SQL templates never appear in training. The win is real but narrow in kind: retrieval ranking over a 12-table schema, not generative quality. Card also publishes the second recipe (in-batch MNRL) which makes top-3 coverage worse than base at 0.748 - only the contrastive one is recorded here. Licence apache-2.0, repo created 2026-09-17.",
 "status": "verified",
 "confidence": 0.5,
 "updated": "2026-10-30",
 "sources": [
  "hf-hari-krishna-ai-text2sql-schema-retriever-minilm"
 ],
 "benchmarks": [
  {
   "name": "All gold tables in top 3",
   "score": 96.3,
   "scale": 100,
   "higher_is_better": true,
   "source": "hf-hari-krishna-ai-text2sql-schema-retriever-minilm",
   "vendor_claim": true,
   "config": "Card '| retriever | recall@1 | recall@3 | all in top 1 | all in top 3 | all in top 5 | MRR |': 'fine-tuned, labelled contrastive' 0.963 vs 'all-MiniLM-L6-v2, off the shelf' 0.812 (x100). 453 test questions, SQL templates unseen in training, top-3 of a 12-table schema."
  },
  {
   "name": "recall@3",
   "score": 98.0,
   "scale": 100,
   "higher_is_better": true,
   "source": "hf-hari-krishna-ai-text2sql-schema-retriever-minilm",
   "vendor_claim": true,
   "config": "Same table, base 0.920 (x100). Per-table average, softer than all-in-top-3."
  },
  {
   "name": "MRR",
   "score": 98.7,
   "scale": 100,
   "higher_is_better": true,
   "source": "hf-hari-krishna-ai-text2sql-schema-retriever-minilm",
   "vendor_claim": true,
   "config": "Same table, base 0.916 (x100)."
  },
  {
   "name": "recall@1",
   "score": 70.5,
   "scale": 100,
   "higher_is_better": true,
   "source": "hf-hari-krishna-ai-text2sql-schema-retriever-minilm",
   "vendor_claim": true,
   "config": "Same table, base 0.608 (x100)."
  },
  {
   "name": "All gold tables in top 1",
   "score": 51.7,
   "scale": 100,
   "higher_is_better": true,
   "source": "hf-hari-krishna-ai-text2sql-schema-retriever-minilm",
   "vendor_claim": true,
   "config": "Same table, base 0.446 (x100)."
  }
 ]
}
